[
  {
    "schema_version": "0.1",
    "source_id": "SRC-JINGMAI-20260803-REFRESH01",
    "platform": "other",
    "url": "https://www.news.cn/politics/jmsgclsy/index.htm",
    "captured_at": "2026-08-03T16:20:00+08:00",
    "published_at": "2023-09-17T00:00:00+08:00",
    "published_date_note": "Xinhua heritage context page; stable cultural background, not current road or village-access information.",
    "city_scope": ["Jingmai Mountain"],
    "claim_type": "heritage_context",
    "claim": "Xinhua's heritage coverage describes Jingmai as a tea-forest cultural landscape composed of ancient tea forests, villages and protective forests, and identifies it as a tea-themed World Heritage property; this supports the landscape-system narrative without proving access to private villages or farmers.",
    "commercial_signal": "none_seen",
    "independence": "firsthand_unclear",
    "evidence_status": "lead_only",
    "review_status": "usable_as_context",
    "corroboration_ids": [],
    "module_ids": ["JMM01", "JMM03", "JMM05"],
    "notes": "Use for public heritage interpretation only; village consent, road conditions and accommodation require separate current checks.",
    "source_score": 17,
    "source_use": "lead_only",
    "source_score_reasons": ["firsthand claim unclear"]
  },
  {
    "schema_version": "0.1",
    "source_id": "SRC-JINGMAI-20260803-REFRESH02",
    "platform": "other",
    "url": "https://yn.chinadaily.com.cn/a/202601/17/WS696b1fa9a310942cc499ba56d.html",
    "captured_at": "2026-08-03T16:25:00+08:00",
    "published_at": "2026-01-17T00:00:00+08:00",
    "published_date_note": "China Daily regional report; contemporary context, not a booking or route source.",
    "city_scope": ["Jingmai Mountain"],
    "claim_type": "heritage_context",
    "claim": "The regional China Daily report frames Jingmai as a tea-forest heritage destination within Pu'er’s broader tea-road development; it can support a landscape-and-livelihood research question but cannot validate a private tea ceremony, tea authenticity or village encounter.",
    "commercial_signal": "unclear",
    "independence": "firsthand_unclear",
    "evidence_status": "lead_only",
    "review_status": "needs_corroboration",
    "corroboration_ids": ["SRC-JINGMAI-20260803-REFRESH01"],
    "module_ids": ["JMM01", "JMM02", "JMM06"],
    "notes": "Keep as a research lead; require local road, weather, accommodation and consent records before any deep product release.",
    "source_score": 16,
    "source_use": "lead_only",
    "source_score_reasons": ["firsthand claim unclear", "commercial relationship unclear", "one corroboration", "risk-locked to research lead"]
  }
]
