[
  {"schema_version":"0.1","source_id":"SRC-JINGMAI-20260802-001","platform":"official","url":"https://whc.unesco.org/en/list/1665","captured_at":"2026-08-02T00:00:00+08:00","published_at":null,"published_date_note":"Live World Heritage property page.","city_scope":["Jingmai Mountain, Pu'er"],"claim_type":"heritage_context","claim":"UNESCO describes Jingmai as an organically evolved cultural landscape of old tea groves, forests and traditional villages shaped over a millennium by Blang and Dai communities, local ecological knowledge and governance.","commercial_signal":"none_seen","independence":"official_primary","evidence_status":"corroborated","review_status":"usable_as_context","corroboration_ids":["SRC-JINGMAI-20260802-002"],"notes":"Supports contextual interpretation only; it gives no visitor entitlement to homes, ceremonies, tea gardens or community labour.","source_score":100,"source_use":"context_with_citation","source_score_reasons":["primary authority","one corroboration"]},
  {"schema_version":"0.1","source_id":"SRC-JINGMAI-20260802-002","platform":"official","url":"https://whc.unesco.org/en/list/1665/documents","captured_at":"2026-08-02T00:00:00+08:00","published_at":null,"published_date_note":"Live UNESCO document index.","city_scope":["Jingmai Mountain, Pu'er"],"claim_type":"heritage_context","claim":"UNESCO's Jingmai document index provides nomination and management-plan materials for the landscape's conservation context.","commercial_signal":"none_seen","independence":"official_primary","evidence_status":"corroborated","review_status":"usable_as_context","corroboration_ids":["SRC-JINGMAI-20260802-001"],"notes":"Use to inform low-impact and consent policy, never as a substitute for local permission or current access rules.","source_score":100,"source_use":"context_with_citation","source_score_reasons":["primary authority","one corroboration"]},
  {"schema_version":"0.1","source_id":"SRC-JINGMAI-20260802-003","platform":"reddit","url":"https://www.reddit.com/r/travelchina/comments/1j5qffm/real_minority_ancient_towns_in_jingmai_mountain/","captured_at":"2026-08-02T00:00:00+08:00","published_at":null,"published_date_note":"Search result exposed an approximate age only; exact timestamp was not normalized.","city_scope":["Jingmai Mountain, Pu'er"],"module_ids":["JMM03"],"claim_type":"traveller_friction","claim":"A traveller discussion raises questions about visitor legitimacy, rising tourism and the difference between living villages and a tourism fantasy.","commercial_signal":"none_seen","independence":"firsthand_unclear","evidence_status":"lead_only","review_status":"needs_corroboration","corroboration_ids":[],"notes":"Use to trigger consent and pace questions; do not treat the post as an authority on community rules.","source_score":39,"source_use":"lead_only","source_score_reasons":["firsthand claim unclear"]},
  {"schema_version":"0.1","source_id":"SRC-JINGMAI-20260802-004","platform":"reddit","url":"https://www.reddit.com/r/travelchina/comments/1unw45c/xishuangbanna_rainforest_visit_and_tea_tour/","captured_at":"2026-08-02T00:00:00+08:00","published_at":"2026-07-05T00:00:00+08:00","city_scope":["Jingmai Mountain, Pu'er"],"module_ids":["JMM03","JMM05"],"claim_type":"route_condition","claim":"A traveller discussion notes that access to forest areas may be protected or village-managed and needs direct confirmation.","commercial_signal":"none_seen","independence":"firsthand_unclear","evidence_status":"lead_only","review_status":"dynamic_check_required","corroboration_ids":[],"notes":"Not Jingmai-specific operational evidence; it reinforces the general rule that protected/village-managed access is never inferred.","source_score":39,"source_use":"requires_current_check","source_score_reasons":["firsthand claim unclear"]},
  {"schema_version":"0.1","source_id":"SRC-JINGMAI-20260803-REDDIT01","platform":"reddit","url":"https://www.reddit.com/r/travelchina/comments/1iexmvq/travelling_to_jingmai_shan_or_other_tea_regions/","captured_at":"2026-08-03T00:00:00+08:00","published_at":null,"published_date_note":"Search result indicated publication in the previous year; exact timestamp was not normalized.","city_scope":["Jingmai Mountain, Pu'er"],"module_ids":["JMM02","JMM06"],"claim_type":"traveller_friction","claim":"A tea lover reports difficulty finding reliable arrival information for Jingmai. Use this as a prompt to confirm the guest’s actual arrival, base, connectivity and recovery constraints.","commercial_signal":"unclear","independence":"anonymous_or_unverifiable","evidence_status":"lead_only","review_status":"community_signal_only","corroboration_ids":[],"notes":"It provides no valid transport, vehicle, lodging or timing advice; every practical arrangement needs a client-date check.","source_score":12,"source_use":"lead_only","source_score_reasons":["unverifiable author","commercial relationship unclear","community signal only"]},
  {"schema_version":"0.1","source_id":"SRC-JINGMAI-20260803-REDDIT02","platform":"reddit","url":"https://www.reddit.com/r/puer/comments/1td3kro/trip_to_yunnan/","captured_at":"2026-08-03T00:00:00+08:00","published_at":null,"published_date_note":"Search result indicated publication approximately two months before capture; exact timestamp was not normalized.","city_scope":["Jingmai Mountain, Pu'er"],"module_ids":["JMM01","JMM04"],"claim_type":"traveller_friction","claim":"A tea traveller wants to visit a village and tea mountain, signalling a need to distinguish landscape understanding, village etiquette and buying tea from an assumed farmer introduction.","commercial_signal":"unclear","independence":"anonymous_or_unverifiable","evidence_status":"lead_only","review_status":"community_signal_only","corroboration_ids":[],"notes":"No tea-maker, village, purchase, access or tour claim may be derived from the thread.","source_score":12,"source_use":"lead_only","source_score_reasons":["unverifiable author","commercial relationship unclear","community signal only"]}
]
