[
  {
    "schema_version": "0.1",
    "source_id": "SRC-QUANZHOU-20260803-REFRESH01",
    "platform": "official",
    "url": "https://cbtb.quanzhou.gov.cn/gzcy/zxft/index_15586.htm?id=5155",
    "captured_at": "2026-08-03T15:35:00+08:00",
    "published_at": null,
    "published_date_note": "Official Quanzhou culture-and-tourism interview page; it describes a unified explanation/reservation platform for core heritage sites and a Dehua ceramics-making experience venue.",
    "city_scope": ["Quanzhou", "Dehua"],
    "claim_type": "provider_or_experience",
    "claim": "The official Quanzhou tourism page describes an integrated explanation/reservation platform for 22 core world-heritage sites and names a Dehua ceramics culture venue offering hands-on making; this is a lead for public access research, not a confirmed private workshop or appointment.",
    "commercial_signal": "none_seen",
    "independence": "official_primary",
    "evidence_status": "lead_only",
    "review_status": "dynamic_check_required",
    "corroboration_ids": [],
    "module_ids": ["QZM01", "QZM02", "QZM08"],
    "notes": "Any ceramics activity needs current language, capacity, price, cancellation and filming checks.",
    "source_score": 95,
    "source_use": "requires_current_check",
    "source_score_reasons": ["primary authority"]
  },
  {
    "schema_version": "0.1",
    "source_id": "SRC-QUANZHOU-20260803-REFRESH02",
    "platform": "official",
    "url": "https://www.quanzhou.gov.cn/zfb/xxgk/ztxxgk/ggwhty/zcfg/202310/t20231025_2956910.htm",
    "captured_at": "2026-08-03T15:40:00+08:00",
    "published_at": "2023-10-25T00:00:00+08:00",
    "published_date_note": "Official policy document; stable product-development context but not current venue operations.",
    "city_scope": ["Quanzhou", "Dehua"],
    "claim_type": "heritage_context",
    "claim": "The official Quanzhou policy document links the old city, maritime heritage, visitor infrastructure and Dehua ceramics as distinct cultural-tourism development layers; it supports the maritime-system route thesis without proving a specific factory or craft access arrangement.",
    "commercial_signal": "none_seen",
    "independence": "official_primary",
    "evidence_status": "lead_only",
    "review_status": "usable_as_context",
    "corroboration_ids": [],
    "module_ids": ["QZM01", "QZM03"],
    "notes": "Keep Quanzhou public heritage and Dehua production as separate route decisions.",
    "source_score": 95,
    "source_use": "context_with_citation",
    "source_score_reasons": ["primary authority"]
  }
]
