[
  {
    "schema_version": "0.1",
    "source_id": "SRC-GUANGZHOU-20260803-REFRESH01",
    "platform": "official",
    "url": "https://www.gz.gov.cn/zlgz/tsgz/content/post_10815534.html",
    "captured_at": "2026-08-03T14:00:00+08:00",
    "published_at": "2026-05-18T00:00:00+08:00",
    "published_date_note": "Official Guangzhou government report on 2026 International Museum Day programming.",
    "city_scope": ["Guangzhou"],
    "claim_type": "heritage_context",
    "claim": "The official Guangzhou report describes a citywide museum programme involving nearly 80 venues and frames museums as a bridge between the city and international visitors; this supports a museum-led city reading but not a promise that every venue or programme remains open on a client's date.",
    "commercial_signal": "none_seen",
    "independence": "official_primary",
    "evidence_status": "lead_only",
    "review_status": "usable_as_context",
    "corroboration_ids": [],
    "module_ids": ["GZM01", "GZM02", "GZM03"],
    "notes": "Context source for Guangzhou's port, craft and museum ecology.",
    "source_score": 95,
    "source_use": "context_with_citation",
    "source_score_reasons": ["primary authority"]
  },
  {
    "schema_version": "0.1",
    "source_id": "SRC-GUANGZHOU-20260803-REFRESH02",
    "platform": "official",
    "url": "https://rsj.gz.gov.cn/ywzt/rcgz/rcpx/pxxx/content/post_10077187.html",
    "captured_at": "2026-08-03T14:05:00+08:00",
    "published_at": null,
    "published_date_note": "Official Guangzhou government training-route page; publication timestamp not normalized.",
    "city_scope": ["Guangzhou"],
    "claim_type": "heritage_context",
    "claim": "The official page places the Guangzhou Thirteen Hongs Museum on the former Thirteen Hongs trading-area site and describes its collections as evidence of export art and Sino-Western exchange; use this as a maritime-history lens, not as a generic shopping recommendation.",
    "commercial_signal": "none_seen",
    "independence": "official_primary",
    "evidence_status": "lead_only",
    "review_status": "usable_as_context",
    "corroboration_ids": [],
    "module_ids": ["GZM02", "GZM03"],
    "notes": "Supports the old-city/water/trade route question.",
    "source_score": 95,
    "source_use": "context_with_citation",
    "source_score_reasons": ["primary authority"]
  },
  {
    "schema_version": "0.1",
    "source_id": "SRC-GUANGZHOU-20260803-REFRESH03",
    "platform": "official",
    "url": "https://www.gz.gov.cn/zt/hckhqydt/hsbk/content/post_10701608.html",
    "captured_at": "2026-08-03T14:10:00+08:00",
    "published_at": null,
    "published_date_note": "Official city portal article; it directs visitors to the Guangdong Folk Art Museum WeChat account for advance tickets.",
    "city_scope": ["Guangzhou"],
    "claim_type": "opening_or_access",
    "claim": "The official Guangzhou portal article directs visitors to reserve Chen Clan Academy tickets through the Guangdong Folk Art Museum WeChat account; reservation mechanics and foreign-visitor identity support still require a current check.",
    "commercial_signal": "none_seen",
    "independence": "official_primary",
    "evidence_status": "lead_only",
    "review_status": "dynamic_check_required",
    "corroboration_ids": [],
    "module_ids": ["GZM03"],
    "notes": "Use as a reservation check target, not as a final booking instruction.",
    "source_score": 95,
    "source_use": "requires_current_check",
    "source_score_reasons": ["primary authority"]
  },
  {
    "schema_version": "0.1",
    "source_id": "SRC-SHENZHEN-20260803-REFRESH01",
    "platform": "official",
    "url": "https://www.sz.gov.cn/en_szgov/travel/guide/",
    "captured_at": "2026-08-03T14:20:00+08:00",
    "published_at": null,
    "published_date_note": "Official Shenzhen travel guide page crawled August 3, 2026.",
    "city_scope": ["Shenzhen"],
    "claim_type": "heritage_context",
    "claim": "The official Shenzhen travel guide presents technology and innovation as a visitor-facing city layer and identifies the Shenzhen Science and Technology Museum as a major public cultural facility; it does not imply private company access.",
    "commercial_signal": "none_seen",
    "independence": "official_primary",
    "evidence_status": "lead_only",
    "review_status": "usable_as_context",
    "corroboration_ids": [],
    "module_ids": ["SZM01", "SZM03", "SZM05"],
    "notes": "Supports a public-tech route rather than a corporate-campus promise.",
    "source_score": 95,
    "source_use": "context_with_citation",
    "source_score_reasons": ["primary authority"]
  },
  {
    "schema_version": "0.1",
    "source_id": "SRC-SHENZHEN-20260803-REFRESH02",
    "platform": "official",
    "url": "https://www.sz.gov.cn/en_szgov/news/latest/content/post_12731918.html",
    "captured_at": "2026-08-03T14:25:00+08:00",
    "published_at": null,
    "published_date_note": "Official Shenzhen transport update describing multilingual taxi and bus services.",
    "city_scope": ["Shenzhen"],
    "claim_type": "traveller_friction",
    "claim": "The official transport update describes bilingual announcements and multilingual translation support in taxis and public transport; this is evidence for an inbound-visitor friction question, not a guarantee that every vehicle or route will offer the same service.",
    "commercial_signal": "none_seen",
    "independence": "official_primary",
    "evidence_status": "lead_only",
    "review_status": "dynamic_check_required",
    "corroboration_ids": [],
    "module_ids": ["SZM01", "SZM03"],
    "notes": "Keep the foreign-visitor language layer as a checkable operational benefit, not a sales promise.",
    "source_score": 95,
    "source_use": "requires_current_check",
    "source_score_reasons": ["primary authority"]
  },
  {
    "schema_version": "0.1",
    "source_id": "SRC-SHENZHEN-20260803-REFRESH03",
    "platform": "official",
    "url": "https://www.sz.gov.cn/en_szgov/aboutsz/videos/content/post_12473107.html",
    "captured_at": "2026-08-03T14:30:00+08:00",
    "published_at": null,
    "published_date_note": "Official Shenzhen city narrative page; use for interpretation rather than operational claims.",
    "city_scope": ["Shenzhen"],
    "claim_type": "heritage_context",
    "claim": "The official city narrative links Shenzhen's innovation story with green development, electric mobility, multilingual public services and the city's half-city/half-nature spatial character; the route still needs public evidence rather than corporate access claims.",
    "commercial_signal": "none_seen",
    "independence": "official_primary",
    "evidence_status": "lead_only",
    "review_status": "usable_as_context",
    "corroboration_ids": [],
    "module_ids": ["SZM01", "SZM03", "SZM05"],
    "notes": "Context source for the technology-and-urban-systems frame.",
    "source_score": 95,
    "source_use": "context_with_citation",
    "source_score_reasons": ["primary authority"]
  }
]
