[
  {"schema_version":"0.1","source_id":"SRC-WUDANG-20260802-001","platform":"official","url":"https://whc.unesco.org/en/list/705/","captured_at":"2026-08-02T00:00:00+08:00","published_at":null,"published_date_note":"Live World Heritage property page.","city_scope":["Wudang Mountains"],"claim_type":"heritage_context","claim":"UNESCO describes Wudang as a mountain-based Taoist architectural complex, shaped by Yuan, Ming and Qing achievements and closely linked to the history of religion and early Ming politics.","commercial_signal":"none_seen","independence":"official_primary","evidence_status":"corroborated","review_status":"usable_as_context","corroboration_ids":["SRC-WUDANG-20260802-002"],"notes":"Supports public heritage interpretation only; it does not authorize religious, ritual or private access.","source_score":100,"source_use":"context_with_citation","source_score_reasons":["primary authority","one corroboration"]},
  {"schema_version":"0.1","source_id":"SRC-WUDANG-20260802-002","platform":"official","url":"https://whc.unesco.org/en/decisions/8788/","captured_at":"2026-08-02T00:00:00+08:00","published_at":null,"published_date_note":"Current World Heritage Committee decision page.","city_scope":["Wudang Mountains"],"claim_type":"heritage_context","claim":"A recent World Heritage Committee decision treats the Wudang ensemble as a single sacred mountain setting linked by pathways and landscape context.","commercial_signal":"none_seen","independence":"official_primary","evidence_status":"corroborated","review_status":"usable_as_context","corroboration_ids":["SRC-WUDANG-20260802-001"],"notes":"Useful for explaining why pace and paths matter; not a walking-route safety authority.","source_score":100,"source_use":"context_with_citation","source_score_reasons":["primary authority","one corroboration"]},
  {"schema_version":"0.1","source_id":"SRC-WUDANG-20260802-003","platform":"official","url":"https://wlt.hubei.gov.cn/bmdt/dtyw/202603/t20260324_5898106.shtml","captured_at":"2026-08-02T00:00:00+08:00","published_at":"2026-03-24T00:00:00+08:00","city_scope":["Wudang Mountains"],"claim_type":"provider_or_experience","claim":"Hubei's culture-and-tourism authority reported a 2026 Wudang Tai Chi cultural event.","commercial_signal":"none_seen","independence":"official_primary","evidence_status":"expired","review_status":"excluded","corroboration_ids":[],"notes":"An event report is not an instructor directory, a course schedule, proof of English teaching, lineage claim or wellness claim. It is excluded from current visitor output.","source_score":0,"source_use":"exclude","source_score_reasons":["primary authority","expired"]},
  {"schema_version":"0.1","source_id":"SRC-WUDANG-20260802-004","platform":"official","url":"https://www.chinawudang.com/ennews/5232.html","captured_at":"2026-08-02T00:00:00+08:00","published_at":"2026-04-01T00:00:00+08:00","city_scope":["Wudang Mountains"],"claim_type":"opening_or_access","claim":"The official Wudang scenic-area channel published a 2026 visitor notice covering real-name reservation, Golden Summit time slots and the choice between a hiking direction and a cable-car direction.","commercial_signal":"none_seen","independence":"official_primary","evidence_status":"lead_only","review_status":"dynamic_check_required","corroboration_ids":[],"notes":"A holiday notice establishes that these operations are dynamic. Confirm the relevant notice for the guest's date; do not reuse its exact conditions.","source_score":95,"source_use":"requires_current_check","source_score_reasons":["primary authority"]},
  {"schema_version":"0.1","source_id":"SRC-WUDANG-20260802-005","platform":"reddit","url":"https://www.reddit.com/r/taoism/comments/1unnrow/i_visited_wudang_mountain_as_a_christian_and_it/","captured_at":"2026-08-02T00:00:00+08:00","published_at":"2026-07-04T00:00:00+08:00","city_scope":["Wudang Mountains"],"module_ids":["WDM01","WDM05"],"claim_type":"traveller_friction","claim":"A visitor reflection shows that some international travellers arrive with limited Taoism context and seek respectful interpretation rather than a martial-arts product.","commercial_signal":"none_seen","independence":"firsthand_unclear","evidence_status":"lead_only","review_status":"needs_corroboration","corroboration_ids":[],"notes":"Use only to prompt an interpretation/etiquette question; do not generalize the post's spiritual response.","source_score":39,"source_use":"lead_only","source_score_reasons":["firsthand claim unclear"]},
  {"schema_version":"0.1","source_id":"SRC-WUDANG-20260803-REDDIT01","platform":"reddit","url":"https://www.reddit.com/r/travelchina/comments/1unnnul/wudang_mountain_birth_of_tai_chi_kung_fu_mountain/","captured_at":"2026-08-03T00:00:00+08:00","published_at":null,"published_date_note":"Search result indicated publication approximately four weeks before capture; exact timestamp was not normalized.","city_scope":["Wudang Mountains"],"module_ids":["WDM01","WDM03","WDM05"],"claim_type":"traveller_friction","claim":"A traveller’s response is shaped by the mountain’s visual atmosphere, temples and Tai Chi association. Use it to distinguish public heritage interpretation from cinematic or spiritual expectation.","commercial_signal":"unclear","independence":"anonymous_or_unverifiable","evidence_status":"lead_only","review_status":"community_signal_only","corroboration_ids":[],"notes":"Do not promise mist, monks, ritual observation, route conditions, fitness suitability or a Tai Chi encounter from this reflection.","source_score":12,"source_use":"lead_only","source_score_reasons":["unverifiable author","commercial relationship unclear","community signal only"]},
  {"schema_version":"0.1","source_id":"SRC-WUDANG-20260803-REDDIT02","platform":"reddit","url":"https://www.reddit.com/r/taoism/comments/1m78gi7/best_place_to_learn_in_china/","captured_at":"2026-08-03T00:00:00+08:00","published_at":null,"published_date_note":"Search result indicated publication in the previous year; exact timestamp was not normalized.","city_scope":["Wudang Mountains"],"module_ids":["WDM06","WDM08"],"claim_type":"traveller_friction","claim":"A discussion about studying Taoism and Tai Chi warns that foreign visitors may encounter exaggerated or unreliable instructor claims. It is a diligence trigger, not a claim about any named provider.","commercial_signal":"unclear","independence":"anonymous_or_unverifiable","evidence_status":"lead_only","review_status":"community_signal_only","corroboration_ids":[],"notes":"No training provider can be named, recommended, quoted or sold until identity, teaching language, credentials, venue, group size, safety, filming, cancellation and payment terms are independently recorded.","source_score":12,"source_use":"lead_only","source_score_reasons":["unverifiable author","commercial relationship unclear","community signal only"]}
]
