[
  {
    "schema_version": "0.1",
    "source_id": "SRC-HANGZHOU-20260803-REFRESH01",
    "platform": "other",
    "url": "https://hz.bendibao.com/tour/202327/140112.shtm",
    "captured_at": "2026-08-03T14:40:00+08:00",
    "published_at": null,
    "published_date_note": "Local travel-information page; not an official authority and retained only as a current lead until an official Hangzhou notice is attached.",
    "city_scope": ["Hangzhou"],
    "claim_type": "opening_or_access",
    "claim": "A current local travel-information page reports that Lingyin–Feilai Peak uses time-slot reservation and lists seasonal opening windows; because the page is not the official authority, it can only trigger an official recheck before a client route is released.",
    "commercial_signal": "unclear",
    "independence": "firsthand_unclear",
    "evidence_status": "lead_only",
    "review_status": "needs_corroboration",
    "corroboration_ids": [],
    "module_ids": ["HZM03"],
    "notes": "Intentionally not used as a final operating fact. Find the official West Lake/Lingyin notice before delivery.",
    "source_score": 9,
    "source_use": "lead_only",
    "source_score_reasons": ["firsthand claim unclear", "commercial relationship unclear", "risk-locked to research lead"]
  },
  {
    "schema_version": "0.1",
    "source_id": "SRC-HANGZHOU-20260803-REFRESH02",
    "platform": "other",
    "url": "https://ori.hangzhou.com.cn/ornews/content/2025-11/24/content_9130347.htm",
    "captured_at": "2026-08-03T14:45:00+08:00",
    "published_at": "2025-11-24T00:00:00+08:00",
    "published_date_note": "Hangzhou local media report on the reservation channel and identity matching for Lingyin–Feilai Peak.",
    "city_scope": ["Hangzhou"],
    "claim_type": "opening_or_access",
    "claim": "A Hangzhou local-media report describes real-name, time-slot reservation and identity matching for Lingyin–Feilai Peak; retain it as a corroboration lead and replace it with an official notice before publishing current entry instructions.",
    "commercial_signal": "none_seen",
    "independence": "firsthand_unclear",
    "evidence_status": "lead_only",
    "review_status": "needs_corroboration",
    "corroboration_ids": ["SRC-HANGZHOU-20260803-REFRESH01"],
    "module_ids": ["HZM03"],
    "notes": "Useful because it exposes a foreign-visitor identity-friction question; not a release source.",
    "source_score": 24,
    "source_use": "lead_only",
    "source_score_reasons": ["firsthand claim unclear", "one corroboration", "risk-locked to research lead"]
  },
  {
    "schema_version": "0.1",
    "source_id": "SRC-SUZHOU-20260803-REFRESH01",
    "platform": "official",
    "url": "https://english.suzhou.gov.cn/szsenglish/sjwhyclm/201611/0e774293426145f6b4b00d3a5717c6df.shtml",
    "captured_at": "2026-08-03T14:55:00+08:00",
    "published_at": null,
    "published_date_note": "Official Suzhou municipal garden description; static context page with old reservation language that must not be treated as current.",
    "city_scope": ["Suzhou"],
    "claim_type": "heritage_context",
    "claim": "The official Suzhou municipal page frames the Humble Administrator's Garden through water, pavilions, bridges and advance reservation; use it for the garden-as-attention story, while treating ticket and reservation details as stale until rechecked.",
    "commercial_signal": "none_seen",
    "independence": "official_primary",
    "evidence_status": "lead_only",
    "review_status": "dynamic_check_required",
    "corroboration_ids": [],
    "module_ids": ["SZUM01", "SZUM02"],
    "notes": "Separates stable interpretation from unstable reservation instructions.",
    "source_score": 95,
    "source_use": "requires_current_check",
    "source_score_reasons": ["primary authority"]
  },
  {
    "schema_version": "0.1",
    "source_id": "SRC-SUZHOU-20260803-REFRESH02",
    "platform": "official",
    "url": "https://ylj.suzhou.gov.cn/szsylj/mpjg/wztt.shtml",
    "captured_at": "2026-08-03T15:00:00+08:00",
    "published_at": null,
    "published_date_note": "Official Suzhou Garden Bureau ticket-price table; price and season labels are dynamic fields.",
    "city_scope": ["Suzhou"],
    "claim_type": "price_or_purchase",
    "claim": "The official Suzhou Garden Bureau table distinguishes peak and off-season prices for major gardens, including the Humble Administrator's Garden; actual visitor-date price, ticket identity rules and reservation channel require a current check.",
    "commercial_signal": "none_seen",
    "independence": "official_primary",
    "evidence_status": "lead_only",
    "review_status": "dynamic_check_required",
    "corroboration_ids": [],
    "module_ids": ["SZUM01", "SZUM08"],
    "notes": "Do not copy a static price into a client quote without checking the official booking channel.",
    "source_score": 95,
    "source_use": "requires_current_check",
    "source_score_reasons": ["primary authority"]
  },
  {
    "schema_version": "0.1",
    "source_id": "SRC-SUZHOU-20260803-REFRESH03",
    "platform": "official",
    "url": "https://english.suzhou.gov.cn/szsenglish/pcdl/202201/e9e9d81b38844d5d81a4670185c2bea4/files/b4dc9640060348068183472803c14d0c.pdf",
    "captured_at": "2026-08-03T15:05:00+08:00",
    "published_at": null,
    "published_date_note": "Official Pocket Suzhou PDF; stable interpretive context, not current operations.",
    "city_scope": ["Suzhou"],
    "claim_type": "heritage_context",
    "claim": "The official Pocket Suzhou guide describes the Humble Administrator's Garden through meandering water, pavilions and bridges and includes canal-city context; it supports a one-garden/one-water-layer route thesis, not a complete itinerary or current opening claim.",
    "commercial_signal": "none_seen",
    "independence": "official_primary",
    "evidence_status": "lead_only",
    "review_status": "usable_as_context",
    "corroboration_ids": [],
    "module_ids": ["SZUM01", "SZUM02"],
    "notes": "Use for story framing only; pair with a current date-specific garden check.",
    "source_score": 95,
    "source_use": "context_with_citation",
    "source_score_reasons": ["primary authority"]
  }
]
