[
  {
    "schema_version": "0.1",
    "source_id": "SRC-SHANGHAI-20260803-REFRESH01",
    "platform": "official",
    "url": "https://english.shanghai.gov.cn/en-MuseumsGalleries/20231218/01fdd3f62d0c4877bc289ec0b1de6afa.html",
    "captured_at": "2026-08-03T12:00:00+08:00",
    "published_at": null,
    "published_date_note": "Official visitor-information page; publication timestamp not normalized.",
    "city_scope": ["Shanghai"],
    "claim_type": "opening_or_access",
    "claim": "The official visitor-information page lists Shanghai Museum People's Square hours as 9:00–17:00 with last admission at 16:00 and Monday closure except public holidays; individual reservation rules must be checked again for the client's dates.",
    "commercial_signal": "none_seen",
    "independence": "official_primary",
    "evidence_status": "lead_only",
    "review_status": "dynamic_check_required",
    "corroboration_ids": [],
    "module_ids": ["SHM04"],
    "notes": "Dated web capture for research refresh. Not a field record and not a guarantee for September 2026.",
    "source_score": 95,
    "source_use": "requires_current_check",
    "source_score_reasons": ["primary authority"]
  },
  {
    "schema_version": "0.1",
    "source_id": "SRC-SHANGHAI-20260803-REFRESH02",
    "platform": "official",
    "url": "https://english.shanghai.gov.cn/en-Latest-WhatsNew/20240913/665093caee7643cf87a17e44a22bf7be.html",
    "captured_at": "2026-08-03T12:05:00+08:00",
    "published_at": "2024-09-13T00:00:00+08:00",
    "published_date_note": "Page states Wednesday–Monday, 10:00–18:00, last entry 17:00; some sections still require reservations.",
    "city_scope": ["Shanghai"],
    "claim_type": "opening_or_access",
    "claim": "The official Shanghai Museum East update describes reservation-free individual entry for the main museum while noting that some sections, including the Digital Gallery and Curio-city, still require reservations; current opening and exhibition rules remain date-sensitive.",
    "commercial_signal": "none_seen",
    "independence": "official_primary",
    "evidence_status": "lead_only",
    "review_status": "dynamic_check_required",
    "corroboration_ids": [],
    "module_ids": ["SHM04"],
    "notes": "Dated web capture for research refresh. Treat as a check target, not a final guest instruction.",
    "source_score": 95,
    "source_use": "requires_current_check",
    "source_score_reasons": ["primary authority"]
  },
  {
    "schema_version": "0.1",
    "source_id": "SRC-SHANGHAI-20260803-REFRESH03",
    "platform": "official",
    "url": "https://www.meet-in-shanghai.net/en/guide/exploring-shanghais-waterfront-10-huangpu-river-tour-routes-603448/",
    "captured_at": "2026-08-03T12:10:00+08:00",
    "published_at": null,
    "published_date_note": "Official city tourism page displayed as recently published at capture; exact timestamp not normalized.",
    "city_scope": ["Shanghai"],
    "claim_type": "route_condition",
    "claim": "The current city tourism guide presents multiple Huangpu waterfront route options and gives route-specific boarding information, including a reminder to board at least 30 minutes early for listed cruises; exact service and pier conditions still require date checks.",
    "commercial_signal": "none_seen",
    "independence": "official_primary",
    "evidence_status": "lead_only",
    "review_status": "dynamic_check_required",
    "corroboration_ids": [],
    "module_ids": ["SHM01", "SHM06"],
    "notes": "Useful for route-shape research and operational check design; it does not justify promising a cruise or a specific pier.",
    "source_score": 95,
    "source_use": "requires_current_check",
    "source_score_reasons": ["primary authority"]
  }
]
