[
  {
    "schema_version": "0.1",
    "source_id": "SRC-WUDANG-20260803-REFRESH01",
    "platform": "other",
    "url": "https://us.trip.com/travel-guide/attraction/danjiangkou/wudang-mountain-10546988/",
    "captured_at": "2026-08-03T16:05:00+08:00",
    "published_at": null,
    "published_date_note": "Third-party travel platform listing; not an official ticket or operating authority.",
    "city_scope": ["Wudang Mountains"],
    "claim_type": "other",
    "claim": "A third-party listing reports an approximate Wudang scenic-area opening window and advises advance attention to official ticketing; because the source is not official, retain it only as a prompt to locate and check the official scenic-area notice.",
    "commercial_signal": "affiliate_or_commission",
    "independence": "firsthand_unclear",
    "evidence_status": "lead_only",
    "review_status": "needs_corroboration",
    "corroboration_ids": [],
    "module_ids": ["WDM02", "WDM03"],
    "notes": "No public route release, cable-car promise or training access should be based on this record.",
    "source_score": 0,
    "source_use": "lead_only",
    "source_score_reasons": ["firsthand claim unclear", "commercial incentive", "risk-locked to research lead"]
  },
  {
    "schema_version": "0.1",
    "source_id": "SRC-WUDANG-20260803-REFRESH02",
    "platform": "other",
    "url": "https://wh.bendibao.com/tour/2024731/181552.shtm",
    "captured_at": "2026-08-03T16:10:00+08:00",
    "published_at": null,
    "published_date_note": "Local travel-information page; explicitly retained as a lead until official Wudang channels are found.",
    "city_scope": ["Wudang Mountains"],
    "claim_type": "other",
    "claim": "A local travel-information page reports real-name online reservation and a separate timed reservation for the Golden Summit; this is useful for designing a human check, but it cannot be used as a current ticket or capacity guarantee.",
    "commercial_signal": "unclear",
    "independence": "firsthand_unclear",
    "evidence_status": "lead_only",
    "review_status": "needs_corroboration",
    "corroboration_ids": [],
    "module_ids": ["WDM01", "WDM08"],
    "notes": "Keep Wudang at research-led status until official current notices and field route evidence are collected.",
    "source_score": 9,
    "source_use": "lead_only",
    "source_score_reasons": ["firsthand claim unclear", "commercial relationship unclear", "risk-locked to research lead"]
  }
]
