[
  {
    "schema_version": "0.1",
    "source_id": "SRC-BEIJING-20260803-REFRESH01",
    "platform": "official",
    "url": "https://english.beijing.gov.cn/specials/ticketing/index.html",
    "captured_at": "2026-08-03T13:00:00+08:00",
    "published_at": null,
    "published_date_note": "Official Beijing ticketing index; individual attraction rules must be opened and checked separately.",
    "city_scope": ["Beijing"],
    "claim_type": "opening_or_access",
    "claim": "The official Beijing attraction index provides current seasonal opening and ticketing fields for listed attractions, including peak-season hours; it should be used as a navigation point to the exact attraction record rather than as a substitute for a Palace Museum or Wall reservation check.",
    "commercial_signal": "none_seen",
    "independence": "official_primary",
    "evidence_status": "lead_only",
    "review_status": "dynamic_check_required",
    "corroboration_ids": [],
    "module_ids": ["BJM01", "BJM04"],
    "notes": "Dated research refresh for September 2026 planning. Exact attraction page and identity requirements still need a final check.",
    "source_score": 95,
    "source_use": "requires_current_check",
    "source_score_reasons": ["primary authority"]
  },
  {
    "schema_version": "0.1",
    "source_id": "SRC-BEIJING-20260803-REFRESH02",
    "platform": "official",
    "url": "https://english.beijing.gov.cn/travellinginbeijing/attractions/202603/t20260325_4566115.html",
    "captured_at": "2026-08-03T13:05:00+08:00",
    "published_at": "2026-03-25T00:00:00+08:00",
    "published_date_note": "Official Mutianyu page dated March 25, 2026; public-transport and facility details are dynamic.",
    "city_scope": ["Beijing"],
    "claim_type": "transport",
    "claim": "The official Mutianyu page describes the section, location, public-transport connection and supporting facilities such as cable cars; route choice still depends on the guest's body, transfer budget, weather and current service status.",
    "commercial_signal": "none_seen",
    "independence": "official_primary",
    "evidence_status": "lead_only",
    "review_status": "dynamic_check_required",
    "corroboration_ids": [],
    "module_ids": ["BJM04"],
    "notes": "Use to frame the Wall decision, not to promise a specific bus, cable car or return timing.",
    "source_score": 95,
    "source_use": "requires_current_check",
    "source_score_reasons": ["primary authority"]
  },
  {
    "schema_version": "0.1",
    "source_id": "SRC-BEIJING-20260803-REFRESH03",
    "platform": "official",
    "url": "https://english.beijing.gov.cn/specials/parktours/guidevisitors/templeofheaven/",
    "captured_at": "2026-08-03T13:10:00+08:00",
    "published_at": null,
    "published_date_note": "Official Temple of Heaven visitor guide; seasonal hours and Monday closures for interior sites are displayed on the page.",
    "city_scope": ["Beijing"],
    "claim_type": "opening_or_access",
    "claim": "The official Temple of Heaven visitor guide separates park-gate hours from the hours of individual interior sites and notes Monday closure for several enclosed attractions except statutory holidays; the route must therefore distinguish the park layer from the hall layer.",
    "commercial_signal": "none_seen",
    "independence": "official_primary",
    "evidence_status": "lead_only",
    "review_status": "dynamic_check_required",
    "corroboration_ids": [],
    "module_ids": ["BJM02"],
    "notes": "Useful for the ritual/park module and weekday fallback logic; not a final entry instruction.",
    "source_score": 95,
    "source_use": "requires_current_check",
    "source_score_reasons": ["primary authority"]
  },
  {
    "schema_version": "0.1",
    "source_id": "SRC-BEIJING-20260803-REFRESH04",
    "platform": "official",
    "url": "https://english.beijing.gov.cn/latest/news/202606/t20260630_4738683.html",
    "captured_at": "2026-08-03T13:15:00+08:00",
    "published_at": "2026-06-30T00:00:00+08:00",
    "published_date_note": "Official summer night-tour notice; a seasonal event cannot be carried forward to September without confirmation.",
    "city_scope": ["Beijing"],
    "claim_type": "weather_or_season",
    "claim": "The official notice documents a 2026 summer night-tour relaunch at Mutianyu with a defined open section and reservation channel; this is a seasonal signal, not evidence that a September night tour will operate.",
    "commercial_signal": "none_seen",
    "independence": "official_primary",
    "evidence_status": "lead_only",
    "review_status": "dynamic_check_required",
    "corroboration_ids": [],
    "module_ids": ["BJM04"],
    "notes": "Keep as a conditional alternative only; never place it in a dated client plan without a new official notice.",
    "source_score": 95,
    "source_use": "requires_current_check",
    "source_score_reasons": ["primary authority"]
  }
]
