[
  {"schema_version":"0.1","source_id":"SRC-QUANZHOU-20260802-001","platform":"official","url":"https://whc.unesco.org/en/list/1561","captured_at":"2026-08-02T00:00:00+08:00","published_at":null,"published_date_note":"World Heritage property page is maintained as a live reference.","city_scope":["Quanzhou","Dehua"],"claim_type":"heritage_context","claim":"UNESCO frames Song-Yuan Quanzhou as an integrated maritime system connecting production, transport, marketing, institutions and socio-cultural life, including ceramic production sites and a land-water network.","commercial_signal":"none_seen","independence":"official_primary","evidence_status":"corroborated","review_status":"usable_as_context","corroboration_ids":["SRC-QUANZHOU-20260802-002"],"notes":"The core interpretive source for route design; it supports connections, not a requirement to visit every component.","source_score":100,"source_use":"context_with_citation","source_score_reasons":["primary authority","one corroboration"]},
  {"schema_version":"0.1","source_id":"SRC-QUANZHOU-20260802-002","platform":"official","url":"https://whc.unesco.org/en/documents/180500","captured_at":"2026-08-02T00:00:00+08:00","published_at":"2020-01-27T00:00:00+08:00","city_scope":["Quanzhou","Dehua"],"claim_type":"heritage_context","claim":"The UNESCO nomination dossier supplies a research pathway for the component-site relationship between Quanzhou's trade system and Dehua kiln production.","commercial_signal":"none_seen","independence":"official_primary","evidence_status":"corroborated","review_status":"usable_as_context","corroboration_ids":["SRC-QUANZHOU-20260802-001"],"notes":"Use for research and interpretive rigor; do not treat it as current visitor-operation guidance.","source_score":100,"source_use":"context_with_citation","source_score_reasons":["primary authority","one corroboration"]},
  {"schema_version":"0.1","source_id":"SRC-DEHUA-20260802-001","platform":"official","url":"https://gxj.quanzhou.gov.cn/zwgk/tzgg/202604/t20260430_3288305.htm","captured_at":"2026-08-02T00:00:00+08:00","published_at":"2026-04-30T00:00:00+08:00","city_scope":["Dehua"],"claim_type":"heritage_context","claim":"A Quanzhou industry-policy consultation describes a current direction toward ceramic culture tourism, public cultural facilities and Dehua kiln archaeological-park development.","commercial_signal":"none_seen","independence":"official_primary","evidence_status":"lead_only","review_status":"usable_as_context","corroboration_ids":[],"notes":"Policy intention is not proof a specific factory, workshop or exhibition can be visited; use only to guide research questions.","source_score":95,"source_use":"context_with_citation","source_score_reasons":["primary authority"]},
  {"schema_version":"0.1","source_id":"SRC-DEHUA-20260802-002","platform":"official","url":"https://www.quanzhou.gov.cn/zfb/xxgk/zfxxgkzl/qzdt/xsqdt/202601/t20260119_3258226.htm","captured_at":"2026-08-02T00:00:00+08:00","published_at":"2026-01-19T00:00:00+08:00","city_scope":["Dehua"],"claim_type":"provider_or_experience","claim":"A municipal report describes Dehua's expanding industrial-tourism and cultural-project landscape, including Red Flag Factory cultural-tourism development.","commercial_signal":"none_seen","independence":"official_primary","evidence_status":"lead_only","review_status":"dynamic_check_required","corroboration_ids":[],"notes":"Do not infer foreign-language service, studio access, workshop availability or quality from this report.","source_score":95,"source_use":"requires_current_check","source_score_reasons":["primary authority"]},
  {"schema_version":"0.1","source_id":"SRC-DEHUA-20260802-003","platform":"official","url":"https://www.quanzhou.gov.cn/zfb/xxgk/zfxxgkzl/qzdt/qzyw/202602/t20260202_3263762.htm","captured_at":"2026-08-02T00:00:00+08:00","published_at":"2026-02-02T00:00:00+08:00","city_scope":["Dehua"],"claim_type":"transport","claim":"Quanzhou municipal government reported the opening of the Zhengzhou–Yong'an Expressway Dehua section in February 2026.","commercial_signal":"none_seen","independence":"official_primary","evidence_status":"lead_only","review_status":"dynamic_check_required","corroboration_ids":[],"notes":"Infrastructure news is not a client transport plan. Travel time, buses, drivers and conditions must be checked for the guest date.","source_score":95,"source_use":"requires_current_check","source_score_reasons":["primary authority"]},
  {"schema_version":"0.1","source_id":"SRC-DEHUA-20260802-004","platform":"official","url":"https://quanzhou.gov.cn/zfb/xxgk/ztxxgk/xwfbh/202604/t20260423_3285687.htm","captured_at":"2026-08-02T00:00:00+08:00","published_at":"2026-04-23T00:00:00+08:00","city_scope":["Dehua"],"claim_type":"provider_or_experience","claim":"A municipal seasonal-consumption announcement listed ceramic-themed activities in Dehua, including events at Dehua Ceramic Art City and Red Flag Factory.","commercial_signal":"none_seen","independence":"official_primary","evidence_status":"expired","review_status":"excluded","corroboration_ids":[],"notes":"A seasonal campaign is retained only as a research lead. It is explicitly excluded from present visitor output.","source_score":0,"source_use":"exclude","source_score_reasons":["primary authority","expired"]},
  {"schema_version":"0.1","source_id":"SRC-QUANZHOU-20260803-YT01","platform":"youtube","url":"https://www.youtube.com/watch?v=qA6UEeKxsX8","captured_at":"2026-08-03T00:00:00+08:00","published_at":"2023-03-04T00:00:00+08:00","city_scope":["Quanzhou"],"module_ids":["QZM02","QZM04"],"claim_type":"traveller_friction","claim":"An identified foreign travel creator presents Quanzhou through religious plurality, historic quarters, food and a slower city rhythm. This is a demand-language signal, not verification of any site, access or itinerary.","commercial_signal":"unclear","independence":"firsthand_identified","evidence_status":"lead_only","review_status":"community_signal_only","corroboration_ids":[],"notes":"Use to test English positioning and the questions a foreign visitor brings. Do not cite it for operations, religious access, venue quality or route timing.","source_score":44,"source_use":"lead_only","source_score_reasons":["identified firsthand account","commercial relationship unclear","community signal only"]},
  {"schema_version":"0.1","source_id":"SRC-QUANZHOU-20260803-REDDIT01","platform":"reddit","url":"https://www.reddit.com/r/travelchina/comments/1re5no3/plog_eat_and_pray_in_fuzhou_quanzhou/","captured_at":"2026-08-03T00:00:00+08:00","published_at":null,"published_date_note":"Search result indicated a post from approximately five months earlier; exact timestamp was not normalized.","city_scope":["Quanzhou"],"module_ids":["QZM08"],"claim_type":"traveller_friction","claim":"A traveller discussion frames Quanzhou as little-known to foreign visitors while recognising its domestic-travel visibility. It is a lead for researching language, discovery and crowd-expectation friction only.","commercial_signal":"unclear","independence":"anonymous_or_unverifiable","evidence_status":"lead_only","review_status":"community_signal_only","corroboration_ids":[],"notes":"Do not convert a forum observation into a visitor-volume, safety, hotel, transport or access claim.","source_score":12,"source_use":"lead_only","source_score_reasons":["unverifiable author","commercial relationship unclear","community signal only"]}
]
