[
  {"schema_version":"0.1","source_id":"SRC-GUILIN-20260802-001","platform":"official","url":"https://whc.unesco.org/en/list/1248","captured_at":"2026-08-02T00:00:00+08:00","published_at":null,"published_date_note":"Live World Heritage property page.","city_scope":["Guilin","Yangshuo"],"claim_type":"heritage_context","claim":"UNESCO identifies Guilin Karst as the best-known continental fenglin expression within the South China Karst World Heritage property.","commercial_signal":"none_seen","independence":"official_primary","evidence_status":"corroborated","review_status":"usable_as_context","corroboration_ids":["SRC-GUILIN-20260802-002"],"notes":"Supports landscape interpretation, not a compulsory sightseeing sequence or weather claim.","source_score":100,"source_use":"context_with_citation","source_score_reasons":["primary authority","one corroboration"]},
  {"schema_version":"0.1","source_id":"SRC-GUILIN-20260802-002","platform":"official","url":"https://en.liriver.com.cn/page/article/zjlj.ljjj","captured_at":"2026-08-02T00:00:00+08:00","published_at":null,"published_date_note":"Live official Li River introduction page.","city_scope":["Guilin","Yangshuo"],"claim_type":"heritage_context","claim":"The Li River Scenic Area official site provides a public interpretation of the Guilin-to-Yangshuo river corridor.","commercial_signal":"none_seen","independence":"official_primary","evidence_status":"corroborated","review_status":"usable_as_context","corroboration_ids":["SRC-GUILIN-20260802-001"],"notes":"Do not infer a specific vessel, duration, price or pier from an introduction page.","source_score":100,"source_use":"context_with_citation","source_score_reasons":["primary authority","one corroboration"]},
  {"schema_version":"0.1","source_id":"SRC-GUILIN-20260802-003","platform":"official","url":"https://www.lijiangriver.org.cn/page/article/zxlj.tzgg/182","captured_at":"2026-08-02T00:00:00+08:00","published_at":"2026-06-23T08:26:00+08:00","city_scope":["Guilin","Yangshuo"],"module_ids":["GYM02"],"claim_type":"opening_or_access","claim":"The Li River Scenic Area issued a June 2026 notice on restoration of operations for its essence-route cruises.","commercial_signal":"none_seen","independence":"official_primary","evidence_status":"lead_only","review_status":"dynamic_check_required","corroboration_ids":[],"notes":"The existence of a restoration notice proves that operations can change; the client-facing status must be confirmed afresh.","source_score":95,"source_use":"requires_current_check","source_score_reasons":["primary authority"]},
  {"schema_version":"0.1","source_id":"SRC-GUILIN-20260802-004","platform":"reddit","url":"https://www.reddit.com/r/chinatravel/comments/1uscng7/is_guilinyangshuo_safe_to_visit_or_is_there_still/","captured_at":"2026-08-02T00:00:00+08:00","published_at":null,"published_date_note":"Search result exposed an approximate age only; exact timestamp was not normalized.","city_scope":["Guilin","Yangshuo"],"module_ids":["GYM08"],"claim_type":"weather_or_season","claim":"A traveller discussion asks about flood risk, wet conditions and current river appearance in the Guilin–Yangshuo area.","commercial_signal":"none_seen","independence":"firsthand_unclear","evidence_status":"lead_only","review_status":"needs_corroboration","corroboration_ids":[],"notes":"Use to trigger date-specific weather and water-condition questions, never as safety advice or a forecast.","source_score":39,"source_use":"requires_current_check","source_score_reasons":["firsthand claim unclear"]},
  {"schema_version":"0.1","source_id":"SRC-YANGSHUO-20260802-001","platform":"reddit","url":"https://www.reddit.com/r/traveltochinamainland/comments/1tnq6iu/yangshuo_and_guilin_without_cycling_or_scooters/","captured_at":"2026-08-02T00:00:00+08:00","published_at":"2026-05-26T00:00:00+08:00","city_scope":["Yangshuo"],"module_ids":["GYM03"],"claim_type":"traveller_friction","claim":"A visitor question asks whether Yangshuo is worthwhile without cycling or scooters, revealing a recurring mobility and transport-assumption problem.","commercial_signal":"none_seen","independence":"firsthand_unclear","evidence_status":"lead_only","review_status":"needs_corroboration","corroboration_ids":[],"notes":"Do not answer with a generic yes/no. Route design must test mobility, confidence, road conditions and current alternatives.","source_score":39,"source_use":"lead_only","source_score_reasons":["firsthand claim unclear"]},
  {"schema_version":"0.1","source_id":"SRC-YANGSHUO-20260803-REDDIT01","platform":"reddit","url":"https://www.reddit.com/r/chinatravel/comments/1u7xqw8/guilin_area_cycling_question_best_route_from/","captured_at":"2026-08-03T00:00:00+08:00","published_at":null,"published_date_note":"Search result indicated publication approximately one month before capture; exact timestamp was not normalized.","city_scope":["Yangshuo"],"module_ids":["GYM03","GYM05"],"claim_type":"traveller_friction","claim":"A cycling visitor asks for a route between Xingping and Yangshuo, signalling that activity level, road confidence, route distance and weather tolerance must be elicited before recommending countryside movement.","commercial_signal":"unclear","independence":"anonymous_or_unverifiable","evidence_status":"lead_only","review_status":"community_signal_only","corroboration_ids":[],"notes":"The thread supplies no safe route, vehicle, rental, weather or road-condition advice for client delivery.","source_score":12,"source_use":"lead_only","source_score_reasons":["unverifiable author","commercial relationship unclear","community signal only"]},
  {"schema_version":"0.1","source_id":"SRC-GUILIN-LONGSHENG-20260803-REDDIT01","platform":"reddit","url":"https://www.reddit.com/r/travelchina/comments/1vdgzkv/need_advice_on_guilin_longsheng_yangshuo_itinerary/","captured_at":"2026-08-03T00:00:00+08:00","published_at":"2026-08-03T00:00:00+08:00","city_scope":["Guilin","Yangshuo"],"module_ids":["GYM07"],"claim_type":"traveller_friction","claim":"A same-day itinerary question links Guilin, Longsheng and Yangshuo, signalling a common tendency to add Longji without protecting intercity transfer time.","commercial_signal":"unclear","independence":"anonymous_or_unverifiable","evidence_status":"lead_only","review_status":"community_signal_only","corroboration_ids":[],"notes":"Do not derive a specific transfer sequence or duration from discussion replies; verify every client-date connection independently.","source_score":12,"source_use":"lead_only","source_score_reasons":["unverifiable author","commercial relationship unclear","community signal only"]}
]
