[
  {
    "schema_version": "0.1",
    "source_id": "SRC-CHENGDU-20260803-REFRESH01",
    "platform": "official",
    "url": "https://m.panda.org.cn/en/service/ticket/",
    "captured_at": "2026-08-03T13:25:00+08:00",
    "published_at": null,
    "published_date_note": "Official Panda Base ticket page; displayed hours and reservation windows are subject to operational changes.",
    "city_scope": ["Chengdu"],
    "claim_type": "opening_or_access",
    "claim": "The official Panda Base ticket page separates morning and afternoon entry windows, states that March–October uses an earlier morning window, and says tickets may be reserved online up to 14 days ahead until the daily quota sells out; this should shape a dated morning decision rather than a fixed all-day promise.",
    "commercial_signal": "none_seen",
    "independence": "official_primary",
    "evidence_status": "lead_only",
    "review_status": "dynamic_check_required",
    "corroboration_ids": [],
    "module_ids": ["CDM02"],
    "notes": "The module should ask whether pandas are worth the transfer and early start for this client; check the actual travel date later.",
    "source_score": 95,
    "source_use": "requires_current_check",
    "source_score_reasons": ["primary authority"]
  },
  {
    "schema_version": "0.1",
    "source_id": "SRC-CHENGDU-20260803-REFRESH02",
    "platform": "official",
    "url": "https://m.panda.org.cn/en/service/notice/",
    "captured_at": "2026-08-03T13:30:00+08:00",
    "published_at": null,
    "published_date_note": "Official visitor-information page for the Panda Base gates and tourist centres.",
    "city_scope": ["Chengdu"],
    "claim_type": "opening_or_access",
    "claim": "The official visitor-information page lists seasonal opening hours for the West and South Gate tourist centres; gate selection and internal movement should be checked against the client's hotel, transport and chosen route.",
    "commercial_signal": "none_seen",
    "independence": "official_primary",
    "evidence_status": "lead_only",
    "review_status": "dynamic_check_required",
    "corroboration_ids": [],
    "module_ids": ["CDM02"],
    "notes": "Use to prevent the Panda Base from being written as a simple city-centre stop.",
    "source_score": 95,
    "source_use": "requires_current_check",
    "source_score_reasons": ["primary authority"]
  },
  {
    "schema_version": "0.1",
    "source_id": "SRC-CHENGDU-20260803-REFRESH03",
    "platform": "official",
    "url": "https://m.panda.org.cn/en/service/transit/",
    "captured_at": "2026-08-03T13:35:00+08:00",
    "published_at": null,
    "published_date_note": "Official Panda Base public-transport guide; page explicitly says route suggestions are subject to real-time traffic conditions.",
    "city_scope": ["Chengdu"],
    "claim_type": "transport",
    "claim": "The official public-transport guide tells visitors to follow real-time traffic conditions and treats route suggestions as changeable; this supports a transfer-budget warning and prevents the agent from hard-coding a single route to the Panda Base.",
    "commercial_signal": "none_seen",
    "independence": "official_primary",
    "evidence_status": "lead_only",
    "review_status": "dynamic_check_required",
    "corroboration_ids": [],
    "module_ids": ["CDM02", "CDM01"],
    "notes": "Transport evidence only; it does not select the best hotel area or guarantee travel time.",
    "source_score": 95,
    "source_use": "requires_current_check",
    "source_score_reasons": ["primary authority"]
  },
  {
    "schema_version": "0.1",
    "source_id": "SRC-CHENGDU-20260803-REFRESH04",
    "platform": "official",
    "url": "https://www.gochengdu.cn/",
    "captured_at": "2026-08-03T13:40:00+08:00",
    "published_at": null,
    "published_date_note": "Official city tourism portal used only for city-context framing; individual venue pages require separate review.",
    "city_scope": ["Chengdu"],
    "claim_type": "heritage_context",
    "claim": "The official city tourism portal presents Chengdu through pandas, food, culture and contemporary urban life; this is a broad framing source and cannot by itself support a recommendation for a specific tea house, meal or neighbourhood encounter.",
    "commercial_signal": "none_seen",
    "independence": "official_primary",
    "evidence_status": "lead_only",
    "review_status": "usable_as_context",
    "corroboration_ids": [],
    "module_ids": ["CDM01", "CDM03", "CDM04"],
    "notes": "Use as a context source only; the differentiated route still depends on module questions and firsthand checks.",
    "source_score": 95,
    "source_use": "context_with_citation",
    "source_score_reasons": ["primary authority"]
  }
]
