[
  {
    "schema_version": "0.1",
    "source_id": "SRC-GUILIN-20260803-REFRESH01",
    "platform": "official",
    "url": "https://www.liriver.com.cn/",
    "captured_at": "2026-08-03T15:20:00+08:00",
    "published_at": null,
    "published_date_note": "Official Lijiang scenic-area tourism portal with online ticketing and a recommended Guilin–Yangshuo water route.",
    "city_scope": ["Guilin", "Yangshuo"],
    "claim_type": "opening_or_access",
    "claim": "The official Lijiang portal offers online ticketing and presents the Mopanshan/Zhujiang-to-Yangshuo water route as a recommended product; route choice, pier, water conditions and departure time still require a date-specific check.",
    "commercial_signal": "none_seen",
    "independence": "official_primary",
    "evidence_status": "lead_only",
    "review_status": "dynamic_check_required",
    "corroboration_ids": [],
    "module_ids": ["GYM02", "GYM08"],
    "notes": "Do not convert the portal's recommended route into a fixed cruise promise.",
    "source_score": 95,
    "source_use": "requires_current_check",
    "source_score_reasons": ["primary authority"]
  },
  {
    "schema_version": "0.1",
    "source_id": "SRC-GUILIN-20260803-REFRESH02",
    "platform": "official",
    "url": "https://www.guilin.gov.cn/ywdt/zwdt/t27483657.shtml",
    "captured_at": "2026-08-03T15:25:00+08:00",
    "published_at": null,
    "published_date_note": "Official Guilin government tourism update describing current river-service and immersive-water-tourism activity.",
    "city_scope": ["Guilin", "Yangshuo"],
    "claim_type": "route_condition",
    "claim": "The official Guilin update describes current Lijiang river tourism services and water-based cultural programming; it supports treating the river as an active operating system, not just scenery, while exact services remain dynamic.",
    "commercial_signal": "none_seen",
    "independence": "official_primary",
    "evidence_status": "lead_only",
    "review_status": "dynamic_check_required",
    "corroboration_ids": [],
    "module_ids": ["GYM02", "GYM03"],
    "notes": "Use to frame the water/land decision and weather fallback.",
    "source_score": 95,
    "source_use": "requires_current_check",
    "source_score_reasons": ["primary authority"]
  }
]
