[
  {"schema_version":"0.1","source_id":"SRC-JINGDEZH-20260802-001","platform":"official","url":"https://whc.unesco.org/en/list/1765/","captured_at":"2026-08-02T00:00:00+08:00","published_at":null,"published_date_note":"Live World Heritage property page; entry listed as 2026.","city_scope":["Jingdezhen"],"claim_type":"heritage_context","claim":"UNESCO describes Jingdezhen's serial porcelain-industry sites as an integrated system of raw materials, transport, kiln innovation, production organization, trade and artistic influence from the 10th to 19th centuries.","commercial_signal":"none_seen","independence":"official_primary","evidence_status":"corroborated","review_status":"usable_as_context","corroboration_ids":["SRC-JINGDEZH-20260802-002"],"notes":"Core narrative source; it does not establish current entry, studio access or workshop availability.","source_score":100,"source_use":"context_with_citation","source_score_reasons":["primary authority","one corroboration"]},
  {"schema_version":"0.1","source_id":"SRC-JINGDEZH-20260802-002","platform":"official","url":"https://whc.unesco.org/document/226095","captured_at":"2026-08-02T00:00:00+08:00","published_at":null,"published_date_note":"World Heritage Committee working document published in 2026; exact timestamp not normalized.","city_scope":["Jingdezhen"],"claim_type":"heritage_context","claim":"The World Heritage Committee evaluation describes the production system's archaeological, technical, social and environmental attributes, including kilns, raw-material areas, roads, rivers and community practices.","commercial_signal":"none_seen","independence":"official_primary","evidence_status":"corroborated","review_status":"usable_as_context","corroboration_ids":["SRC-JINGDEZH-20260802-001"],"notes":"Use to keep the route systemic rather than object-only; no current-operation claim.","source_score":100,"source_use":"context_with_citation","source_score_reasons":["primary authority","one corroboration"]},
  {"schema_version":"0.1","source_id":"SRC-JINGDEZH-20260802-003","platform":"official","url":"https://www.jci.edu.cn/english/index.htm","captured_at":"2026-08-02T00:00:00+08:00","published_at":null,"published_date_note":"Institutional English home page is live.","city_scope":["Jingdezhen"],"claim_type":"heritage_context","claim":"Jingdezhen Ceramic University provides a public institutional reference for the city's continuing ceramic education and research ecology.","commercial_signal":"none_seen","independence":"official_primary","evidence_status":"lead_only","review_status":"usable_as_context","corroboration_ids":[],"notes":"It does not imply campus tours, class access, artist meetings or English instruction for visitors.","source_score":95,"source_use":"context_with_citation","source_score_reasons":["primary authority"]},
  {"schema_version":"0.1","source_id":"SRC-JINGDEZH-20260802-004","platform":"official","url":"https://www.cjicb.com/index_en.html","captured_at":"2026-08-02T00:00:00+08:00","published_at":null,"published_date_note":"Biennale English site is live; event timing must be checked.","city_scope":["Jingdezhen"],"claim_type":"opening_or_access","claim":"The Jingdezhen International Ceramic Art Biennale English site is a current public source for specific 2026 biennale programme information.","commercial_signal":"none_seen","independence":"official_primary","evidence_status":"lead_only","review_status":"dynamic_check_required","corroboration_ids":[],"notes":"Event content, dates, ticketing and language access require guest-date verification.","source_score":95,"source_use":"requires_current_check","source_score_reasons":["primary authority"]},
  {"schema_version":"0.1","source_id":"SRC-JINGDEZH-20260802-005","platform":"reddit","url":"https://www.reddit.com/r/Ceramics/comments/1uueevy/im_a_ceramic_artist_who_live_in_jingdezhen_for/","captured_at":"2026-08-02T00:00:00+08:00","published_at":"2026-07-12T00:00:00+08:00","city_scope":["Jingdezhen"],"module_ids":["JZM03","JZM05","JZM08"],"claim_type":"traveller_friction","claim":"A long-term resident ceramic artist's discussion indicates that private introductions and access are relationship-dependent and that English information is uneven.","commercial_signal":"unclear","independence":"firsthand_unclear","evidence_status":"lead_only","review_status":"needs_corroboration","corroboration_ids":[],"notes":"This is a prompt for a consent/release workflow, never a basis for promising studio or master access.","source_score":31,"source_use":"lead_only","source_score_reasons":["firsthand claim unclear","commercial relationship unclear"]},
  {"schema_version":"0.1","source_id":"SRC-JINGDEZH-20260803-REDDIT01","platform":"reddit","url":"https://www.reddit.com/r/Ceramics/comments/1q0nvq9/jingdezhen_china_1_day_pottery_workshop/","captured_at":"2026-08-03T00:00:00+08:00","published_at":null,"published_date_note":"Search result indicated publication approximately seven months before capture; exact timestamp was not normalized.","city_scope":["Jingdezhen"],"module_ids":["JZM05"],"claim_type":"traveller_friction","claim":"A visitor asks for a one- or two-day pottery workshop, signalling a short-format learning expectation distinct from residency, apprenticeship or studio access.","commercial_signal":"unclear","independence":"anonymous_or_unverifiable","evidence_status":"lead_only","review_status":"community_signal_only","corroboration_ids":[],"notes":"Do not infer any studio's language, dates, teaching quality, safety, price, firing, delivery or availability.","source_score":12,"source_use":"lead_only","source_score_reasons":["unverifiable author","commercial relationship unclear","community signal only"]},
  {"schema_version":"0.1","source_id":"SRC-JINGDEZH-20260803-REDDIT02","platform":"reddit","url":"https://www.reddit.com/r/Pottery/comments/1ocmhmb/purchasing_clay_in_china/","captured_at":"2026-08-03T00:00:00+08:00","published_at":null,"published_date_note":"Search result indicated publication approximately nine months before capture; exact timestamp was not normalized.","city_scope":["Jingdezhen"],"module_ids":["JZM04"],"claim_type":"traveller_friction","claim":"A pottery traveller asks about taking ceramic materials home, signalling that buying, materials, transport and export expectations may appear inside a cultural visit.","commercial_signal":"unclear","independence":"anonymous_or_unverifiable","evidence_status":"lead_only","review_status":"community_signal_only","corroboration_ids":[],"notes":"Never provide customs, shipping, safety, provenance, price, supplier or export advice from this discussion; direct such questions to current official and carrier guidance.","source_score":12,"source_use":"lead_only","source_score_reasons":["unverifiable author","commercial relationship unclear","community signal only"]}
]
