[
  {
    "schema_version": "0.1",
    "source_id": "SRC-JINGDEZHEN-20260803-REFRESH01",
    "platform": "official",
    "url": "https://www.jdz.gov.cn/zwgk/fdzdgknr/zdlyxxgk/shgysyyzdmsly/ggwh/t1085885.shtml",
    "captured_at": "2026-08-03T15:50:00+08:00",
    "published_at": "2026-03-31T00:00:00+08:00",
    "published_date_note": "Official Jingdezhen China Ceramics Museum reservation notice dated March 31, 2026.",
    "city_scope": ["Jingdezhen"],
    "claim_type": "opening_or_access",
    "claim": "The official museum notice states that the museum opens Tuesday–Sunday, stops entry at 16:30 and closes at 17:00, with Monday closure except statutory holidays; it also says the sole official reservation channel is the Changyou Jingdezhen WeChat mini-program and that individual visitors may reserve up to five days ahead when quota exists.",
    "commercial_signal": "none_seen",
    "independence": "official_primary",
    "evidence_status": "lead_only",
    "review_status": "dynamic_check_required",
    "corroboration_ids": [],
    "module_ids": ["JZM02", "JZM08"],
    "notes": "Foreign visitors' identity and payment path must be tested separately; do not recommend third-party reservation sellers.",
    "source_score": 95,
    "source_use": "requires_current_check",
    "source_score_reasons": ["primary authority"]
  },
  {
    "schema_version": "0.1",
    "source_id": "SRC-JINGDEZHEN-20260803-REFRESH02",
    "platform": "official",
    "url": "https://www.jingdezhenzgtcbwg.cn/",
    "captured_at": "2026-08-03T15:55:00+08:00",
    "published_at": null,
    "published_date_note": "Official museum website with current opening and reservation links.",
    "city_scope": ["Jingdezhen"],
    "claim_type": "opening_or_access",
    "claim": "The official museum site positions the China Ceramics Museum as a free public museum with a Tuesday–Sunday opening pattern and a reservation entry point; it supports a technical-history module, not a studio, workshop or purchase promise.",
    "commercial_signal": "none_seen",
    "independence": "official_primary",
    "evidence_status": "lead_only",
    "review_status": "dynamic_check_required",
    "corroboration_ids": ["SRC-JINGDEZHEN-20260803-REFRESH01"],
    "module_ids": ["JZM01", "JZM02"],
    "notes": "Use for public museum interpretation and date-specific checks.",
    "source_score": 100,
    "source_use": "requires_current_check",
    "source_score_reasons": ["primary authority", "one corroboration"]
  }
]
